[
  {
    "albumtitle": "Whatever People Say I Am, Thats What Im Not",
    "wikipedia": "Whatever_People_Say_I_Am,_That%27s_What_I%27m_Not",
    "artist": "Arctic Monkeys",
    "genre": "Indie rock",
    "metacritic": 82,
    "lengthalbum": "00:40:05",
    "released": "2006-01-23",
    "musiclabel": "Domino",
    "numberofsingles": 2,
    "songs": [
      {
        "song": " The View from the Afternoon",
        "songlength": "00:03:38"
      },
      {
        "song": " I Bet You Look Good on the Dancefloor",
        "songlength": "00:02:53"
      },
      {
        "song": " Fake Tales of San Francisco",
        "songlength": "00:02:57"
      },
      {
        "song": " Dancing Shoes",
        "songlength": "00:02:21"
      },
      {
        "song": " You Probably Couldnt See for the Lights but You Were Staring Straight at Me",
        "songlength": "00:02:10"
      },
      {
        "song": " Still Take You Home",
        "songlength": "00:02:53"
      },
      {
        "song": "Riot Van",
        "songlength": "00:02:14"
      },
      {
        "song": " Red Light Indicates Doors Are Secured",
        "songlength": "00:02:23"
      },
      {
        "song": " Mardy Bum",
        "songlength": "00:02:55"
      },
      {
        "song": " Perhaps Vampires Is a Bit Strong But..",
        "songlength": "00:04:28"
      },
      {
        "song": " When the Sun Goes Down",
        "songlength": "00:03:20"
      },
      {
        "song": " From the Ritz to the Rubble",
        "songlength": "00:03:13"
      },
      {
        "song": " A Certain Romance",
        "songlength": "00:05:31"
      }
    ]
  }
]